{"hook":"本周GitHub热榜，我挑了十个能马上看懂用途的项目。有人在补工具链，有人已经做出能演示的产品。","mid_reset":"前五个偏产品和平台，后五个更贴近开发流。下面继续往上排。","outro":"这周前十能看出一个方向：大家都在把代理、接口和协作，往可交付产品继续压实。","projects":[{"repo":"alibaba/open-code-review","spoken":"第十名Open Code Review，做AI代码审查命令行。README给出行级评论、全库scan和基准。取向偏高精度，召回率明确压低。","headline":"阿里把内部审查器开源了","verdict":"适合想把AI审查接进现有提交流程的团队。","facts":["line-level review","full repo scan"],"layout":"split","accent":"#FFB000","primary_asset":0,"secondary_asset":1},{"repo":"citrolabs/ego-lite","spoken":"第九名ego-lite，是给代理跑浏览器自动化的共享浏览器。README有演示视频，也写明当前只支持macOS。Windows和Linux还在路线图上。","headline":"把登录态借给代理用的浏览器","verdict":"演示很顺，但平台覆盖现在还偏窄。","facts":["macOS only","demo video"],"layout":"cinematic","accent":"#00C2FF","primary_asset":2,"secondary_asset":0},{"repo":"ruvnet/RuView","spoken":"第八名RuView，把普通WiFi变成空间感知和生命体征监测。README列了Home Assistant、Matter和Apple Home接入。核心证据很足，硬件门槛仍要自己评估。","headline":"用WiFi做空间感知","verdict":"概念够抓人，落地前先看你家设备条件。","facts":["WiFi sensing","smart home"],"layout":"signal","accent":"#FF5A36","primary_asset":2,"secondary_asset":0},{"repo":"earendil-works/pi","spoken":"第七名Pi Agent Harness，是一套代理运行时加编码CLI。README拆成统一LLM接口、agent core和TUI。权限隔离内建缺席，容器化要自己补。","headline":"一套拆开的代理工具箱","verdict":"模块清楚，安全边界需要使用方自建。","facts":["agent runtime","no sandbox"],"layout":"terminal","accent":"#8CFF3F","primary_asset":1,"secondary_asset":0},{"repo":"ayghri/i-have-adhd","spoken":"第六名i-have-adhd，是约束编码助手输出风格的技能包。README直接给前后对比，主打先结论再步骤。它解决表达层，业务能力仍看宿主代理。","headline":"专治答案埋太深的技能","verdict":"很轻，见效快，但只改说法不补能力。","facts":["output style","before after"],"layout":"focus","accent":"#FFD400","primary_asset":0,"secondary_asset":1},{"repo":"diegosouzapw/OmniRoute","spoken":"第五名OmniRoute，想做一个聚合多家模型的免费网关。README写到单端点、自动回退和免费额度面板。额度两周复核一次，数字会随目录变化。","headline":"把免费模型额度拢成一个入口","verdict":"对多模型工作流很实用，运营数据会持续波动。","facts":["single endpoint","quota fallback"],"layout":"stack","accent":"#00E5A8","primary_asset":0,"secondary_asset":2},{"repo":"bojieli/ai-agent-book","spoken":"第四名ai-agent-book，是一本把Agent原理讲到工程实践的开源书。README列出十章正文、九十三个实验和九种语言。优势是系统化，产品演示型素材偏少。","headline":"把Agent工程化写成整本书","verdict":"适合系统补课，视觉资产主要靠封面。","facts":["93 labs","9 languages"],"layout":"split","accent":"#FF6B6B","primary_asset":0,"secondary_asset":null},{"repo":"koala73/worldmonitor","spoken":"第三名worldmonitor，做全球情报监控和新闻聚合大盘。README写了五百多个信源、十五类主题和MCP发布。功能面很宽，许可证栏目前给的是NOASSERTION。","headline":"把全球新闻揉成态势面板","verdict":"信息密度高，商用前先核对授权边界。","facts":["500+ feeds","MCP server"],"layout":"cinematic","accent":"#39D0FF","primary_asset":1,"secondary_asset":0},{"repo":"mattpocock/skills","spoken":"第二名mattpocock/skills，给工程师整理可组合的代理技能。README强调小而可改，支持插件安装和skills.sh分发。装两套会重复，这个限制写得很直白。","headline":"工程师味很重的技能仓","verdict":"方法论清楚，安装路径要提前选一种。","facts":["composable skills","dual install"],"layout":"signal","accent":"#FF8A00","primary_asset":1,"secondary_asset":0},{"repo":"block/buzz","spoken":"第一名block/buzz，做人和代理同房间协作的自托管工作区。README把消息、审批和git事件都放进同一签名日志。今天主打单relay，多社区托管是运营形态。","headline":"把代理直接拉进团队工作区","verdict":"方向很完整，当前默认部署形态还偏单点。","facts":["self-hostable","signed event log"],"layout":"terminal","accent":"#7CFF00","primary_asset":0,"secondary_asset":1}]}