{"hook":"这周榜单从图像工作流到安全路由都有硬货，我按第十到第一顺着讲，让你一遍听懂它们能拿来干什么。","mid_reset":"前半段偏效率和学习，后半段开始上强工具和团队能力，风格会明显变硬。","outro":"这十个项目里，有的适合马上装来用，有的适合先收藏慢慢啃。先记住名字，周末挑一个动手就够了。","projects":[{"repo":"Comfy-Org/ComfyUI","spoken":"排在第十的是 ComfyUI。做图、做视频、接模型全靠节点拖拽，工作流能拼得很深，还能连 API 和后端。上手会花点时间，可一旦跑顺，扩展空间特别大。","headline":"节点流图像工坊登榜","verdict":"会折腾工作流的人，很容易越用越上头。","facts":["node workflows","diffusion GUI+API"],"layout":"split","accent":"#7CFF00","primary_asset":0,"secondary_asset":1},{"repo":"different-ai/openwork","spoken":"第九名 openwork，想把 Claude Cowork 那套协作体验搬进开源栈。它基于 opencode，适合团队一起盯任务、看上下文、分配动作，自己部署也更踏实。","headline":"开源协作台上桌了","verdict":"面向团队的 AI 协作界面，味道很新。","facts":["opencode powered","team workspace"],"layout":"focus","accent":"#FF6A00","primary_asset":0,"secondary_asset":1},{"repo":"donnemartin/system-design-primer","spoken":"第八名 system-design-primer，很多工程师刷系统设计面试都绕不过它。缓存、分片、队列这些大题拆得够细，还顺手给了 Anki 卡片，复习和查漏都很顺。","headline":"系统设计老牌教材回潮","verdict":"面试备战和基础回炉，都有稳定参考。","facts":["system design","Anki flashcards"],"layout":"stack","accent":"#00C2FF","primary_asset":0,"secondary_asset":1},{"repo":"usekaneo/kaneo","spoken":"第七名 kaneo，给讨厌臃肿项目管理工具的人准备。界面干净，支持自托管，页面反应也快；团队开任务、排优先级、跟进进度时，干扰会少很多。","headline":"轻量项目管理很对胃口","verdict":"想把 PM 工具收拾利落，这个方向讨喜。","facts":["self-hosted PM","fast UI"],"layout":"cinematic","accent":"#FFD400","primary_asset":0,"secondary_asset":1},{"repo":"virgiliojr94/book-to-skill","spoken":"第六名 book-to-skill，能把技术书 PDF 直接转成 Claude Code skill。边读边用的味道很强，做笔记、复盘和随手查询都方便，厚书也更容易沉成可复用经验。","headline":"技术书直接变技能包","verdict":"把阅读成果塞回工作流，这点很实用。","facts":["PDF to skill","Claude Code"],"layout":"signal","accent":"#FF2D55","primary_asset":0,"secondary_asset":1},{"repo":"esengine/DeepSeek-Reasonix","spoken":"第五名 DeepSeek-Reasonix，是个贴着 DeepSeek 缓存机制设计的终端编码代理。长会话省 token 很猛，不过老的 TypeScript 线已转维护，新活主要在 Go 重写版。","headline":"终端代理专盯缓存效率","verdict":"深度绑定 DeepSeek，适合长时段连续干活。","facts":["DeepSeek only","Go rewrite"],"layout":"terminal","accent":"#39FFB6","primary_asset":0,"secondary_asset":1},{"repo":"lyogavin/airllm","spoken":"第四名 airllm，主打小显存也能跑超大模型推理，还尽量不先做量化。单张 4GB GPU 就敢碰 70B，这对本地实验党和旧卡用户，吸引力很直接。","headline":"小显存冲大模型推理","verdict":"手里卡不豪华的人，看完很难不心动。","facts":["4GB GPU","70B inference"],"layout":"split","accent":"#9B5CFF","primary_asset":0,"secondary_asset":1},{"repo":"TencentCloud/TencentDB-Agent-Memory","spoken":"第三名 TencentDB-Agent-Memory，给多 Agent 团队管记忆。聊天、技能、知识和代码图谱能一起沉淀，少喂重复上下文，长任务更省 token，协作也更顺。","headline":"团队记忆层开始成型","verdict":"多代理协作想跑久一点，这类底座很关键。","facts":["team memory hub","Code-Graph"],"layout":"focus","accent":"#00E5FF","primary_asset":2,"secondary_asset":0},{"repo":"microsoft/AI-For-Beginners","spoken":"第二名 AI-For-Beginners，把 AI 入门拆成 12 周 24 课，课程节奏配得很成体系。适合刚起步的人按章节往前走，拿它搭学习计划，比东翻西找省心。","headline":"微软入门课又热起来","verdict":"新手想系统开局，这套课还是很稳。","facts":["12 weeks","24 lessons"],"layout":"stack","accent":"#FFB000","primary_asset":0,"secondary_asset":1},{"repo":"zhaoxuya520/reverse-skill","spoken":"第一名 reverse-skill，给逆向、授权渗透和安全研究场景做技能路由。遇到 APK、ELF、JS 加密或 CTF，它会先分流再起工具链，少走弯路，流程也更稳。","headline":"安全技能路由包冲到榜首","verdict":"安全活最怕乱试命令，这套分流思路很抓人。","facts":["skill router","authorized pentest"],"layout":"cinematic","accent":"#FF3B30","primary_asset":0,"secondary_asset":2}]}